<?xml version="1.0" encoding="UTF-8"?>
<!ELEMENT personal (persona)+>
<!ELEMENT persona (dades,email*,url*,relaci贸?)>
<!ATTLIST persona id ID #REQUIRED>
<!ATTLIST persona note CDATA #IMPLIED>
<!ATTLIST persona contr (true|false) >
<!ATTLIST persona salary CDATA #IMPLIED>
<!ELEMENT dades ((cognom,nom)|(nom,cognom))>
<!ELEMENT cognom (#PCDATA)>
<!ELEMENT nom (#PCDATA)>
<!ELEMENT email (#PCDATA)>
<!ELEMENT url EMPTY>
<!ATTLIST url href CDATA 'http://'>
<!ELEMENT relaci贸 EMPTY>
<!ATTLIST relaci贸 director IDREF #IMPLIED>
<!ATTLIST relaci贸 treballador IDREFS #IMPLIED>
